{"schema_version":"thieucubu.signal_tracker.v2","updated_at":"2026-10-28T17:10:44+07:00","episodes":[{"episode_id":"HCM:2026-08-21","tracker_version":"thieucubu.signal_tracker.v2","eligible_for_metrics":true,"symbol":"HCM","date_signal":"2026-08-21","mode":"morning_broad","episode_status":"COMPLETED_T20","path_outcome":"STOPPED","sessions_observed":20,"score_at_signal":93,"advanced_score":74,"trade_score":93,"position_score":76,"confidence":94,"price_at_signal":26.3,"price_unit":"thousand_vnd","setup":"VCP_BREAK","regime":"CHOPPY","market_state":"ACCUMULATION","daily_phase":"REACCUMULATION","weekly_phase":"ACCUMULATION","monthly_phase":"ACCUMULATION","breakout_state":"NEAR_BREAK","breakout_level":27.35,"stop_loss":25.0,"take_profit":32.09,"risk_reward":4.44,"date_t5":"2026-08-28","price_t5":26.05,"return_t5":-0.95,"mfe_t5_pct":2.66,"mae_t5_pct":-1.14,"benchmark_return_t5":3.62,"excess_return_t5":-4.57,"date_t10":"2026-09-09","price_t10":26.35,"return_t10":0.19,"mfe_t10_pct":2.85,"mae_t10_pct":-1.71,"benchmark_return_t10":3.34,"excess_return_t10":-3.15,"outcome_date":"2026-09-11","outcome_session":12,"date_t20":"2026-09-23","price_t20":25.5,"return_t20":-3.04,"mfe_t20_pct":2.85,"mae_t20_pct":-7.98,"benchmark_return_t20":1.9,"excess_return_t20":-4.94,"initial_risk_pct":4.94,"entry_next_open":26.5,"overnight_gap_pct":0.76,"date_t1":"2026-08-24","price_t1":26.25,"return_t1":-0.19,"mfe_t1_pct":2.66,"mae_t1_pct":-0.38,"return_open_t1":-0.94,"r_multiple_t1":-0.04,"benchmark_return_t1":1.17,"excess_return_t1":-1.36,"date_t3":"2026-08-26","price_t3":26.5,"return_t3":0.76,"mfe_t3_pct":2.66,"mae_t3_pct":-1.14,"return_open_t3":0.0,"r_multiple_t3":0.15,"benchmark_return_t3":3.01,"excess_return_t3":-2.25,"return_open_t5":-1.7,"r_multiple_t5":-0.19,"return_open_t10":-0.57,"r_multiple_t10":0.04,"return_open_t20":-3.77,"r_multiple_t20":-0.62},{"episode_id":"ABB:2026-09-10","tracker_version":"thieucubu.signal_tracker.v2","eligible_for_metrics":true,"symbol":"ABB","date_signal":"2026-09-10","mode":"eod","episode_status":"COMPLETED_T20","path_outcome":"OPEN","sessions_observed":20,"score_at_signal":89,"advanced_score":81,"trade_score":89,"position_score":79,"confidence":91,"price_at_signal":17.3,"price_unit":"thousand_vnd","setup":"VCP_BREAK","regime":"RECOVERY","market_state":"OPPORTUNITY","daily_phase":"REACCUMULATION","weekly_phase":"REACCUMULATION","monthly_phase":"ACCUMULATION","breakout_state":"NEAR_BREAK","breakout_level":17.4,"stop_loss":16.93,"take_profit":20.41,"risk_reward":8.39,"date_t5":"2026-09-17","price_t5":17.4,"return_t5":0.58,"mfe_t5_pct":0.58,"mae_t5_pct":-0.58,"benchmark_return_t5":-0.35,"excess_return_t5":0.93,"date_t10":"2026-09-24","price_t10":17.6,"return_t10":1.73,"mfe_t10_pct":5.2,"mae_t10_pct":-0.58,"benchmark_return_t10":-2.96,"excess_return_t10":4.69,"initial_risk_pct":2.14,"entry_next_open":17.3,"overnight_gap_pct":0.0,"date_t1":"2026-09-11","price_t1":17.2,"return_t1":-0.58,"mfe_t1_pct":0.0,"mae_t1_pct":-0.58,"return_open_t1":-0.58,"r_multiple_t1":-0.27,"benchmark_return_t1":-1.86,"excess_return_t1":1.28,"date_t3":"2026-09-15","price_t3":17.4,"return_t3":0.58,"mfe_t3_pct":0.58,"mae_t3_pct":-0.58,"return_open_t3":0.58,"r_multiple_t3":0.27,"benchmark_return_t3":-0.99,"excess_return_t3":1.57,"return_open_t5":0.58,"r_multiple_t5":0.27,"return_open_t10":1.73,"r_multiple_t10":0.81,"date_t20":"2026-10-08","price_t20":17.5,"return_t20":1.16,"mfe_t20_pct":5.2,"mae_t20_pct":-0.58,"return_open_t20":1.16,"r_multiple_t20":0.54,"benchmark_return_t20":-4.93,"excess_return_t20":6.09},{"episode_id":"TGP:2026-09-11","tracker_version":"thieucubu.signal_tracker.v2","eligible_for_metrics":true,"symbol":"TGP","date_signal":"2026-09-11","mode":"morning_focus","episode_status":"ACTIVE","path_outcome":"OPEN","sessions_observed":3,"score_at_signal":82,"advanced_score":78,"trade_score":63,"position_score":82,"confidence":84,"price_at_signal":6.5,"price_unit":"thousand_vnd","setup":"DISCOUNT_BASE","regime":"RECOVERY","market_state":"OPPORTUNITY","daily_phase":"MARKUP","weekly_phase":"MARKUP","monthly_phase":"TRANSITION","breakout_state":"NO_BREAKOUT","breakout_level":7.3,"stop_loss":6.24,"take_profit":7.93,"risk_reward":5.44},{"episode_id":"TVA:2026-09-04","tracker_version":"thieucubu.signal_tracker.v2","eligible_for_metrics":true,"symbol":"TVA","date_signal":"2026-09-04","mode":"afternoon_focus","episode_status":"ACTIVE","path_outcome":"OPEN","sessions_observed":1,"score_at_signal":75,"advanced_score":80,"trade_score":75,"position_score":63,"confidence":85,"price_at_signal":13.0,"price_unit":"thousand_vnd","setup":"VCP_BREAK","regime":"BULL","market_state":"ACCUMULATION","daily_phase":"REACCUMULATION","weekly_phase":"ACCUMULATION","monthly_phase":"ACCUMULATION","breakout_state":"NEAR_BREAK","breakout_level":13.28,"stop_loss":11.7,"take_profit":15.86,"risk_reward":2.2,"initial_risk_pct":10.0,"entry_next_open":13.0,"overnight_gap_pct":0.0,"date_t1":"2026-09-30","price_t1":13.0,"return_t1":0.0,"mfe_t1_pct":0.0,"mae_t1_pct":0.0,"return_open_t1":0.0,"r_multiple_t1":0.0,"benchmark_return_t1":-4.56,"excess_return_t1":4.56}],"legacy_summary":{"schema_version":"legacy.v1","record_count":1000,"unique_symbol_dates":495,"duplicate_records":505,"excluded_from_metrics":true,"reason":"calendar-day snapshots and mixed historical price units are not comparable"},"measurement":{"horizons":["T+1","T+3","T+5","T+10","T+20"],"clock":"trading_sessions","benchmark":"VNINDEX","same_bar_stop_target":"STOP_FIRST_CONSERVATIVE","next_open_slippage_tracked":true},"analytics":{"total_eligible_episodes":4,"completed_t10_count":2,"horizons":{"t1":{"count":3,"win_rate_pct":0.0,"avg_return":-0.26,"median_return":-0.19,"avg_excess":1.49,"avg_r":-0.1},"t3":{"count":2,"win_rate_pct":0.0,"avg_return":0.67,"median_return":0.67,"avg_excess":-0.34,"avg_r":0.21},"t5":{"count":2,"win_rate_pct":0.0,"avg_return":-0.18,"median_return":-0.18,"avg_excess":-1.82,"avg_r":0.04},"t10":{"count":2,"win_rate_pct":0.0,"avg_return":0.96,"median_return":0.96,"avg_excess":0.77,"avg_r":0.43},"t20":{"count":2,"win_rate_pct":0.0,"avg_return":-0.94,"median_return":-0.94,"avg_excess":0.57,"avg_r":-0.04}},"calibration":{"score_lt_78":{"count":1,"win_rate_pct":0.0,"avg_return":0.19,"median_return":0.19,"avg_excess":-3.15,"avg_r":0.04},"score_78_84":{"count":1,"win_rate_pct":0.0,"avg_return":1.73,"median_return":1.73,"avg_excess":4.69,"avg_r":0.81},"score_85_plus":{"count":0,"win_rate_pct":0.0,"avg_return":0.0,"median_return":0.0,"avg_excess":null,"avg_r":null}},"calibration_monotonic":null,"by_setup":{"VCP_BREAK":{"count":2,"win_rate_pct":0.0,"avg_return":0.96,"median_return":0.96,"avg_excess":0.77,"avg_r":0.43}},"by_stream":{"unclassified":{"count":2,"win_rate_pct":0.0,"avg_return":0.96,"median_return":0.96,"avg_excess":0.77,"avg_r":0.43}},"by_regime":{"CHOPPY":{"count":1,"win_rate_pct":0.0,"avg_return":0.19,"median_return":0.19,"avg_excess":-3.15,"avg_r":0.04},"RECOVERY":{"count":1,"win_rate_pct":0.0,"avg_return":1.73,"median_return":1.73,"avg_excess":4.69,"avg_r":0.81}},"path_outcomes":{"target_hit":0,"stopped":1,"open":3,"avg_r_multiple_t10":0.43,"avg_return_open_t10":0.58}}}